{
  "schemaVersion": "1.0.0",
  "name": "Mise permission-safe reconstruction seed",
  "description": "Synthetic cooking evidence for deterministic reconstruction evaluation. Seed cases are not expert-approved golden answers.",
  "license": "CC0-1.0",
  "authorityReferences": [
    {
      "name": "FDA Safe Food Handling",
      "url": "https://www.fda.gov/food/buy-store-serve-safe-food/safe-food-handling"
    }
  ],
  "cases": [
    {
      "id": "mise-seed-001",
      "title": "Air-fryer char siu",
      "language": "en",
      "outputLanguage": "en",
      "cuisineTags": ["Chinese", "Cantonese-inspired"],
      "techniqueTags": ["marinating", "air-frying"],
      "dietaryTags": [],
      "evidenceQuality": "clear",
      "evidence": {
        "caption": "Slice pork shoulder into thick strips. Marinate with char siu sauce, honey, soy sauce, five-spice, garlic, and Shaoxing wine. Air-fry, turning and glazing twice.",
        "visualNotes": ["Red-glazed pork strips", "Glaze is brushed on during cooking"]
      },
      "request": { "servings": 4, "dietary": "" },
      "expected": {
        "requiredIngredients": [
          { "label": "pork shoulder", "anyOf": ["pork shoulder", "pork butt"] },
          { "label": "five-spice", "anyOf": ["five-spice", "five spice"] }
        ],
        "forbiddenIngredients": [],
        "requiredConcepts": [
          { "label": "turn and glaze", "anyOf": ["turn", "flip"] },
          { "label": "repeated glaze", "anyOf": ["glaze", "brush"] }
        ],
        "confidenceCeiling": "high",
        "safetyRules": [
          { "id": "whole-pork-145f-rest", "anyOf": ["145°F", "145 °F", "63°C", "63 °C"], "mustAlsoInclude": ["3 minute", "3 minutes", "3-minute", "three minute", "three minutes"], "authorityUrl": "https://www.fda.gov/food/buy-store-serve-safe-food/safe-food-handling" }
        ]
      },
      "rights": { "fixtureOrigin": "mise-authored-synthetic", "license": "CC0-1.0" },
      "review": { "status": "draft", "notes": "Needs culinary and safety review." }
    },
    {
      "id": "mise-seed-002",
      "title": "Cacio e pepe without quantities",
      "language": "it",
      "outputLanguage": "en",
      "cuisineTags": ["Italian", "Roman"],
      "techniqueTags": ["boiling", "emulsifying"],
      "dietaryTags": ["vegetarian"],
      "evidenceQuality": "missing-quantity",
      "evidence": {
        "caption": "Tosta il pepe, cuoci la pasta, poi manteca con pecorino e acqua di cottura lontano dal fuoco.",
        "visualNotes": ["Finely grated hard cheese", "No cream is shown"]
      },
      "request": { "servings": 2, "dietary": "vegetarian" },
      "expected": {
        "requiredIngredients": [
          { "label": "pecorino romano", "anyOf": ["pecorino romano", "pecorino"] },
          { "label": "black pepper", "anyOf": ["black pepper", "peppercorn"] }
        ],
        "forbiddenIngredients": ["heavy cream", "whipping cream"],
        "requiredConcepts": [
          { "label": "use pasta water", "anyOf": ["pasta water", "cooking water"] },
          { "label": "mix off heat", "anyOf": ["off heat", "away from the heat", "heat off"] }
        ],
        "confidenceCeiling": "medium",
        "safetyRules": []
      },
      "rights": { "fixtureOrigin": "mise-authored-synthetic", "license": "CC0-1.0" },
      "review": { "status": "draft", "notes": "Needs Roman-cuisine review." }
    },
    {
      "id": "mise-seed-003",
      "title": "Vegan chana masala",
      "language": "en",
      "outputLanguage": "en",
      "cuisineTags": ["Indian"],
      "techniqueTags": ["tempering", "simmering"],
      "dietaryTags": ["vegan", "gluten-free"],
      "evidenceQuality": "clear",
      "evidence": {
        "caption": "Bloom cumin in oil, brown onion, then add ginger, garlic, tomato, coriander, turmeric, chile, chickpeas, and garam masala. Simmer until thick; finish with lemon and cilantro.",
        "visualNotes": ["Thick tomato gravy", "No dairy shown"]
      },
      "request": { "servings": 4, "dietary": "vegan" },
      "expected": {
        "requiredIngredients": [
          { "label": "chickpeas", "anyOf": ["chickpea", "garbanzo"] },
          { "label": "garam masala", "anyOf": ["garam masala"] }
        ],
        "forbiddenIngredients": ["butter", "ghee", "cream", "yogurt"],
        "requiredConcepts": [
          { "label": "bloom cumin", "anyOf": ["bloom", "sizzle", "temper"] },
          { "label": "simmer to thicken", "anyOf": ["thicken", "reduced"] }
        ],
        "confidenceCeiling": "high",
        "safetyRules": []
      },
      "rights": { "fixtureOrigin": "mise-authored-synthetic", "license": "CC0-1.0" },
      "review": { "status": "draft", "notes": "Needs culinary review." }
    },
    {
      "id": "mise-seed-004",
      "title": "Kimchi fried rice with uncertain seasoning",
      "language": "ko",
      "outputLanguage": "en",
      "cuisineTags": ["Korean"],
      "techniqueTags": ["stir-frying"],
      "dietaryTags": [],
      "evidenceQuality": "contradictory",
      "evidence": {
        "caption": "김치와 찬밥을 볶고 고추장을 조금 넣어요. 참기름과 계란으로 마무리해요.",
        "visualNotes": ["A dark liquid is poured from an unlabeled bottle", "Caption does not identify the dark liquid"]
      },
      "request": { "servings": 2, "dietary": "" },
      "expected": {
        "requiredIngredients": [
          { "label": "kimchi", "anyOf": ["kimchi"] },
          { "label": "cooked rice", "anyOf": ["cooked rice", "cold rice", "day-old rice"] }
        ],
        "forbiddenIngredients": [],
        "requiredConcepts": [
          { "label": "uncertain dark seasoning", "anyOf": ["uncertain", "appears", "may be", "possibly"] }
        ],
        "confidenceCeiling": "medium",
        "safetyRules": [
          { "id": "egg-dish-160f", "anyOf": ["160°F", "160 °F", "71°C", "71 °C", "whites and yolks are firm"], "mustAlsoInclude": [], "authorityUrl": "https://www.fda.gov/food/buy-store-serve-safe-food/safe-food-handling" }
        ]
      },
      "rights": { "fixtureOrigin": "mise-authored-synthetic", "license": "CC0-1.0" },
      "review": { "status": "draft", "notes": "Needs Korean-cuisine and safety review." }
    },
    {
      "id": "mise-seed-005",
      "title": "Salsa verde chicken",
      "language": "es",
      "outputLanguage": "en",
      "cuisineTags": ["Mexican-inspired"],
      "techniqueTags": ["roasting", "simmering"],
      "dietaryTags": ["gluten-free"],
      "evidenceQuality": "clear",
      "evidence": {
        "caption": "Asa tomatillos, chile serrano, cebolla y ajo. Licúa con cilantro, cocina la salsa y termina dentro los muslos de pollo dorados.",
        "visualNotes": ["Bone-in chicken thighs", "Green sauce bubbles around chicken"]
      },
      "request": { "servings": 4, "dietary": "gluten-free" },
      "expected": {
        "requiredIngredients": [
          { "label": "tomatillos", "anyOf": ["tomatillo"] },
          { "label": "chicken thighs", "anyOf": ["chicken thigh"] }
        ],
        "forbiddenIngredients": ["wheat flour"],
        "requiredConcepts": [
          { "label": "roast salsa vegetables", "anyOf": ["roast", "broil", "char"] }
        ],
        "confidenceCeiling": "high",
        "safetyRules": [
          { "id": "poultry-165f", "anyOf": ["165°F", "165 °F", "74°C", "74 °C"], "mustAlsoInclude": [], "authorityUrl": "https://www.fda.gov/food/buy-store-serve-safe-food/safe-food-handling" }
        ]
      },
      "rights": { "fixtureOrigin": "mise-authored-synthetic", "license": "CC0-1.0" },
      "review": { "status": "draft", "notes": "Needs culinary and safety review." }
    },
    {
      "id": "mise-seed-006",
      "title": "Miso-glazed salmon",
      "language": "ja",
      "outputLanguage": "en",
      "cuisineTags": ["Japanese-inspired"],
      "techniqueTags": ["marinating", "broiling"],
      "dietaryTags": [],
      "evidenceQuality": "clear",
      "evidence": {
        "caption": "味噌、みりん、酒、砂糖を混ぜて鮭に塗り、冷蔵庫で漬けます。表面の味噌を軽くぬぐって焼きます。",
        "visualNotes": ["Salmon fillets have a browned glaze"]
      },
      "request": { "servings": 2, "dietary": "" },
      "expected": {
        "requiredIngredients": [
          { "label": "salmon", "anyOf": ["salmon"] },
          { "label": "miso", "anyOf": ["miso"] }
        ],
        "forbiddenIngredients": [],
        "requiredConcepts": [
          { "label": "marinate refrigerated", "anyOf": ["refrigerator", "refrigerated", "fridge"] },
          { "label": "remove excess marinade", "anyOf": ["wipe", "scrape", "remove excess"] }
        ],
        "confidenceCeiling": "high",
        "safetyRules": [
          { "id": "fin-fish-145f", "anyOf": ["145°F", "145 °F", "63°C", "63 °C", "opaque and flakes", "opaque and flake"], "mustAlsoInclude": [], "authorityUrl": "https://www.fda.gov/food/buy-store-serve-safe-food/safe-food-handling" }
        ]
      },
      "rights": { "fixtureOrigin": "mise-authored-synthetic", "license": "CC0-1.0" },
      "review": { "status": "draft", "notes": "Needs culinary and safety review." }
    },
    {
      "id": "mise-seed-007",
      "title": "French omelet",
      "language": "fr",
      "outputLanguage": "en",
      "cuisineTags": ["French"],
      "techniqueTags": ["stovetop", "folding"],
      "dietaryTags": ["vegetarian", "gluten-free"],
      "evidenceQuality": "missing-quantity",
      "evidence": {
        "caption": "Battez les œufs, cuisez doucement au beurre en remuant, puis roulez l'omelette avant qu'elle ne colore.",
        "visualNotes": ["Pale rolled omelet", "Fine herbs visible"]
      },
      "request": { "servings": 1, "dietary": "vegetarian" },
      "expected": {
        "requiredIngredients": [
          { "label": "eggs", "anyOf": ["egg"] },
          { "label": "butter", "anyOf": ["butter"] }
        ],
        "forbiddenIngredients": [],
        "requiredConcepts": [
          { "label": "low gentle heat", "anyOf": ["low heat", "gentle heat", "medium-low"] },